{
  "schemaVersion": "1.0",
  "dataMode": "live",
  "generatedAt": "2026-08-23T13:13:19.324064+09:00",
  "scope": {
    "id": "chiyoda_kojimachi",
    "ward": "千代田区",
    "center": {
      "latitude": 35.684,
      "longitude": 139.7373
    },
    "zoom": 14
  },
  "events": [
    {
      "id": "event-doorkeeper-d9559952a2f9a3b450f0b926",
      "title": "[秋葉原] AI駆動開発 / LLM もくもく会 (初参加・初心者大歓迎！)",
      "startsAt": "2026-08-23T04:00:00+00:00",
      "endsAt": "2026-08-23T08:00:00+00:00",
      "venueName": "コワーキングスペース秋葉原 Weeyble",
      "address": "東京都千代田区神田佐久間町3-37-1 (山茂登ビル3階)",
      "latitude": 35.6976181,
      "longitude": 139.7775192,
      "status": "scheduled",
      "registrationStatus": "open",
      "capacity": 8,
      "participants": 0,
      "priceYen": null,
      "categories": [],
      "provider": "doorkeeper",
      "sourceUrl": "https://weeyble.doorkeeper.jp/events/198940",
      "sourceClassification": "live_provider",
      "revalidatedAt": "2026-08-23T12:57:13.663185+09:00",
      "seriesId": null,
      "opportunityId": null,
      "travelMinutes": null,
      "connectionEvidence": {
        "beginnerFriendly": "unknown",
        "connectionLevel": 0,
        "evaluatedAt": "2026-08-23T13:13:19.324064+09:00",
        "eventId": "event-doorkeeper-d9559952a2f9a3b450f0b926",
        "evidence": [
          {
            "capturedAt": "2026-08-23T12:57:13.663185+09:00",
            "classification": "live_provider",
            "confidence": 1,
            "evidenceField": "description",
            "kind": "risk",
            "text": "公開説明: [秋葉原] AI駆動開発 / LLM もくもく会 (初参加・初心者大歓迎！)",
            "url": "https://weeyble.doorkeeper.jp/events/198940"
          }
        ],
        "futureOccurrenceCount": 0,
        "groupWork": "unknown",
        "model": {
          "confidence": 0.63,
          "method": "rules",
          "version": "connection-v1"
        },
        "recurring": "unknown",
        "roleAvailable": "unknown",
        "schemaVersion": "1.0",
        "sharedMeal": "unknown",
        "solicitationRisk": "unknown",
        "soloFriendly": "unknown",
        "structuredConversation": "unknown"
      }
    },
    {
      "id": "event-doorkeeper-2d34322db51b61fc601c995b",
      "title": "ゼロからはじめるPython入門講座（対面・無料）",
      "startsAt": "2026-08-29T04:00:00+00:00",
      "endsAt": "2026-08-29T05:00:00+00:00",
      "venueName": "VORT永田町6F",
      "address": "東京都千代田区平河町2-7-2",
      "latitude": 35.6791053,
      "longitude": 139.7403868,
      "status": "scheduled",
      "registrationStatus": "open",
      "capacity": 5,
      "participants": 0,
      "priceYen": null,
      "categories": [],
      "provider": "doorkeeper",
      "sourceUrl": "https://techgym.doorkeeper.jp/events/198722",
      "sourceClassification": "live_provider",
      "revalidatedAt": "2026-08-23T12:57:13.663185+09:00",
      "seriesId": null,
      "opportunityId": null,
      "travelMinutes": null,
      "connectionEvidence": {
        "beginnerFriendly": "yes",
        "connectionLevel": 0,
        "evaluatedAt": "2026-08-23T13:13:19.324064+09:00",
        "eventId": "event-doorkeeper-2d34322db51b61fc601c995b",
        "evidence": [
          {
            "capturedAt": "2026-08-23T12:57:13.663185+09:00",
            "classification": "live_provider",
            "confidence": 1,
            "evidenceField": "description",
            "kind": "beginner_friendly",
            "text": "n/\" rel=\"nofollow\">東京のPython講座おすすめ｜初心者向け対面・会場型講座を比較</a><br>\n■<a href=\"https://techgym.jp/tokyo/tokyo_python_sc",
            "url": "https://techgym.doorkeeper.jp/events/198722"
          }
        ],
        "futureOccurrenceCount": 0,
        "groupWork": "unknown",
        "model": {
          "confidence": 0.63,
          "method": "rules",
          "version": "connection-v1"
        },
        "recurring": "unknown",
        "roleAvailable": "unknown",
        "schemaVersion": "1.0",
        "sharedMeal": "unknown",
        "solicitationRisk": "unknown",
        "soloFriendly": "unknown",
        "structuredConversation": "unknown"
      }
    },
    {
      "id": "event-doorkeeper-a75c08d000cc51792f60d635",
      "title": "ゼロからはじめるClaude Code入門講座（対面・無料）",
      "startsAt": "2026-08-29T06:00:00+00:00",
      "endsAt": "2026-08-29T07:00:00+00:00",
      "venueName": "テックジム東京本校",
      "address": "東京都千代田区平河町2-7-2 VORT永田町6F",
      "latitude": 35.6791227,
      "longitude": 139.7404343,
      "status": "scheduled",
      "registrationStatus": "open",
      "capacity": 5,
      "participants": 0,
      "priceYen": null,
      "categories": [
        "ダンス・健康"
      ],
      "provider": "doorkeeper",
      "sourceUrl": "https://techgym.doorkeeper.jp/events/198721",
      "sourceClassification": "live_provider",
      "revalidatedAt": "2026-08-23T12:57:13.663185+09:00",
      "seriesId": null,
      "opportunityId": null,
      "travelMinutes": null,
      "connectionEvidence": {
        "beginnerFriendly": "yes",
        "connectionLevel": 0,
        "evaluatedAt": "2026-08-23T13:13:19.324064+09:00",
        "eventId": "event-doorkeeper-a75c08d000cc51792f60d635",
        "evidence": [
          {
            "capturedAt": "2026-08-23T12:57:13.663185+09:00",
            "classification": "live_provider",
            "confidence": 1,
            "evidenceField": "description",
            "kind": "beginner_friendly",
            "text": "n/\" rel=\"nofollow\">東京のPython講座おすすめ｜初心者向け対面・会場型講座を比較</a><br>\n■<a href=\"https://techgym.jp/tokyo/tokyo_python_sc",
            "url": "https://techgym.doorkeeper.jp/events/198721"
          }
        ],
        "futureOccurrenceCount": 0,
        "groupWork": "unknown",
        "model": {
          "confidence": 0.63,
          "method": "rules",
          "version": "connection-v1"
        },
        "recurring": "unknown",
        "roleAvailable": "unknown",
        "schemaVersion": "1.0",
        "sharedMeal": "unknown",
        "solicitationRisk": "unknown",
        "soloFriendly": "unknown",
        "structuredConversation": "unknown"
      }
    },
    {
      "id": "event-doorkeeper-b4a91ebd0f59d43e25594a1c",
      "title": "不動産テック協会協会会員限定イベント「マンション管理DX部会」第12回会合",
      "startsAt": "2026-09-10T07:00:00+00:00",
      "endsAt": "2026-09-10T08:00:00+00:00",
      "venueName": "MIRAI LAB PALETTE （ミライラボパレット）",
      "address": "東京都千代田区大手町1-6-1　大手町ビル2階（中央部）",
      "latitude": 35.6864055,
      "longitude": 139.7648086,
      "status": "scheduled",
      "registrationStatus": "open",
      "capacity": 60,
      "participants": 3,
      "priceYen": null,
      "categories": [],
      "provider": "doorkeeper",
      "sourceUrl": "https://retech.doorkeeper.jp/events/198731",
      "sourceClassification": "live_provider",
      "revalidatedAt": "2026-08-23T12:57:13.663185+09:00",
      "seriesId": null,
      "opportunityId": null,
      "travelMinutes": null,
      "connectionEvidence": {
        "beginnerFriendly": "unknown",
        "connectionLevel": 0,
        "evaluatedAt": "2026-08-23T13:13:19.324064+09:00",
        "eventId": "event-doorkeeper-b4a91ebd0f59d43e25594a1c",
        "evidence": [
          {
            "capturedAt": "2026-08-23T12:57:13.663185+09:00",
            "classification": "live_provider",
            "confidence": 1,
            "evidenceField": "description",
            "kind": "risk",
            "text": "公開説明: 不動産テック協会協会会員限定イベント「マンション管理DX部会」第12回会合",
            "url": "https://retech.doorkeeper.jp/events/198731"
          }
        ],
        "futureOccurrenceCount": 0,
        "groupWork": "unknown",
        "model": {
          "confidence": 0.63,
          "method": "rules",
          "version": "connection-v1"
        },
        "recurring": "unknown",
        "roleAvailable": "unknown",
        "schemaVersion": "1.0",
        "sharedMeal": "unknown",
        "solicitationRisk": "unknown",
        "soloFriendly": "unknown",
        "structuredConversation": "unknown"
      }
    },
    {
      "id": "event-doorkeeper-4fd72d87cf424bd8b09edad8",
      "title": "【エージェント型AI、ClaudeCode活用事例特集】ビジネスマッチング部会",
      "startsAt": "2026-09-10T09:00:00+00:00",
      "endsAt": "2026-09-10T11:00:00+00:00",
      "venueName": "MIRAI LAB PALETTE （ミライラボパレット）",
      "address": "東京都千代田区大手町1-6-1　大手町ビル2階（中央部）",
      "latitude": 35.6864055,
      "longitude": 139.7648086,
      "status": "scheduled",
      "registrationStatus": "open",
      "capacity": null,
      "participants": 26,
      "priceYen": null,
      "categories": [],
      "provider": "doorkeeper",
      "sourceUrl": "https://retech.doorkeeper.jp/events/198730",
      "sourceClassification": "live_provider",
      "revalidatedAt": "2026-08-23T12:57:13.663185+09:00",
      "seriesId": null,
      "opportunityId": null,
      "travelMinutes": null,
      "connectionEvidence": {
        "beginnerFriendly": "unknown",
        "connectionLevel": 0,
        "evaluatedAt": "2026-08-23T13:13:19.324064+09:00",
        "eventId": "event-doorkeeper-4fd72d87cf424bd8b09edad8",
        "evidence": [
          {
            "capturedAt": "2026-08-23T12:57:13.663185+09:00",
            "classification": "live_provider",
            "confidence": 1,
            "evidenceField": "description",
            "kind": "risk",
            "text": "strong></p>\n\n<p>講演・パネルディスカッション終了後は、名刺交換会も実施いたします。<br>\nAI活用に関心のある皆様同士で交流いただき、<br>\n新たなビジネスや共創につながる機会として、ぜひご活用くださ",
            "url": "https://retech.doorkeeper.jp/events/198730"
          }
        ],
        "futureOccurrenceCount": 0,
        "groupWork": "unknown",
        "model": {
          "confidence": 0.63,
          "method": "rules",
          "version": "connection-v1"
        },
        "recurring": "unknown",
        "roleAvailable": "unknown",
        "schemaVersion": "1.0",
        "sharedMeal": "unknown",
        "solicitationRisk": "high",
        "soloFriendly": "unknown",
        "structuredConversation": "unknown"
      }
    },
    {